<!DOCTYPE noticias
[
<!ELEMENT noticias (noticia+)>
<!ELEMENT noticias (titulo,subtitulo,imagen,descripcion,link)>
<!ELEMENT titulo (#PCDATA)>
<!ELEMENT subtitulo (#PCDATA)>
<!ELEMENT imagen (#PCDATA)>
<!ELEMENT descripcion (#PCDATA)>
<!ELEMENT link (#PCDATA)>
]>